{
  "version": 1,
  "artifact_kind": "review_artifact_preparation",
  "artifact_scope": "template",
  "status": "completed",
  "prepared_at": "YYYY-MM-DDTHH:MM:SSZ",
  "review_prompt_contract": {
    "path": "Docs/agentsflow/runs/YYYY-MM-DD-task-slug/review-prompt-contract.yaml",
    "hash": "sha256:<review-prompt-contract>"
  },
  "source_context": {
    "material_change_id": "YYYY-MM-DD-task-slug-change-1",
    "dirty_policy": "fail-closed",
    "worktree": {
      "status_command": "git status --porcelain=v1 --untracked-files=all",
      "status_entries": [
        {
          "path": "src/example.py",
          "status": "M"
        }
      ],
      "included_dirty_paths": [
        "src/example.py"
      ],
      "excluded_dirty_paths": [
        {
          "path": "notes/scratch.md",
          "reason": "Scratch notes not used as review evidence."
        }
      ]
    }
  },
  "input_artifacts": [
    {
      "path": "AGENTS.md",
      "kind": "agent_instructions",
      "hash": "sha256:<agents-md>",
      "required_by": [
        "external-reviewer-context"
      ]
    }
  ],
  "generated_artifacts": {
    "shared_packet_content": {
      "path": "Docs/agentsflow/runs/YYYY-MM-DD-task-slug/review-packets/shared-content.json",
      "hash": "sha256:<shared-packet-content>"
    },
    "review_packets": [
      {
        "reviewer": "generalist-a",
        "path": "Docs/agentsflow/runs/YYYY-MM-DD-task-slug/review-packets/generalist-a.json",
        "hash": "sha256:<generalist-a-review-packet>",
        "shared_packet_content_hash": "sha256:<shared-packet-content>"
      }
    ],
    "rendered_prompts": [
      {
        "reviewer": "generalist-a",
        "path": "Docs/agentsflow/runs/YYYY-MM-DD-task-slug/review-prompts/generalist-a.md",
        "hash": "sha256:<generalist-a-rendered-prompt>",
        "packet_hash": "sha256:<generalist-a-review-packet>",
        "schema_hash": "sha256:<reviewer-report-schema>",
        "rubric_hash": "sha256:<review-rubric>",
        "role_contract_hash": "sha256:<generalist-role-contract>"
      }
    ],
    "review_invocation_set": {
      "path": "Docs/agentsflow/runs/YYYY-MM-DD-task-slug/review-invocation-set.json",
      "status": "predeclared"
    }
  },
  "reviewer_assignments": [
    {
      "reviewer": "generalist-a",
      "provider": "internal-agent",
      "model_family": "codex",
      "packet_path": "Docs/agentsflow/runs/YYYY-MM-DD-task-slug/review-packets/generalist-a.json",
      "report_path": "Docs/agentsflow/runs/YYYY-MM-DD-task-slug/reviewer-report.generalist-a.json"
    }
  ],
  "validation": {
    "schema": "schemas/review-artifact-preparation.schema.json",
    "deterministic_script": "scripts/reviewers/prepare_review_set_artifacts.py",
    "script_contract": "scripts/contracts/prepare_review_set_artifacts.yaml"
  }
}
